3130,1.2000000000000002,"he had come into my bedroom without knocking just after eleven one morning, while i was working at my screen, hoping to take advantage of volatility in the currency markets."
3131,0.0,there was a square of sunlight on the carpet and he made a point of standing in it.
3132,0.0,i noticed he was wearing one of my turtleneck sweaters.
3133,0.0,he must have taken it from my drawer.
3134,0.0,he told me he had a poem he urgently needed to recite.
3135,0.0,i swivelled in my chair and waited.
3136,-1.0,"when he finished i said unkindly, ""short at least."""
3137,-1.0,"he winced. """
3138,0.0,"a haiku."""
3139,0.0,"nineteen syllables."""
3140,0.0,five
3141,0.0,then seven then five again.
3142,0.0,"here's another."""
3143,0.0,"he paused, looked towards the ceiling."
3144,0.0,"she made prints in time."""
3145,0.0,"i said, ""spacetime?"""
3146,0.0,"i have got to get on."""
3147,0.0,"but look . . ."""
3148,0.0,he left his illuminated spot and came to my desk and put his hand over the mouse.
3149,0.0,"these two rows of figures, do not you see?"
3150,0.0,intersecting fibonacci curves.
3151,0.0,a high probability
3152,-0.25,that if you buy here and wait. . .
3153,0.0,now sell.
3154,0.0,look.
3155,0.0,"you made ps31."""
3156,0.0,he returned to his square of light.
3157,0.0,i sighed and he moved away.
3158,1.75,"as he reached the door i added, ""clean up the kitchen and bathroom, would you, please?"
3159,-0.5,"difficult to do with one hand."""
3160,0.0,he nodded and went away.
3161,2.35,"a kind of peace or stability had settled over our household, despite the matter of gorringe's release."
3162,0.5,i was more relaxed.
3163,-0.6,"adam was spending no time alone with miranda, while i was with her every night."
3164,1.55,i was confident he would keep his promise.
3165,2.75,"he had told me several times that he was in love, and chaste love was fine by me."
3166,0.0,he wrote poems in his thoughts and stored them there.
3167,0.4,he wanted to talk to me about miranda
3168,-0.25,but i usually cut him off.
3169,0.0,i did not dare attempt to power him down
3170,0.0,and i had no particular need.
3171,0.0,the plan to get him back to the salesroom was set aside.
3172,1.35,love appeared to have softened him.
3173,2.75,"for reasons i did not understand, he was eager for my approval."
3174,-1.0,"guilt, perhaps."
3175,-1.0,he had fallen back into a routine of vague obedience.
3176,0.0,i remained cautious because of my wrist
3177,0.6,and i was watchful--
3178,0.0,but nothing of that showed.
3179,0.5,"i reminded myself that he was still my experiment, my adventure."
3180,0.6,it was not supposed to run smooth at every turn.
3181,2.05,with adam's love came intellectual exuberance.
3182,0.1,"he insisted on telling me his latest thoughts, his theories, his aphorisms, his latest reading."
3183,0.0,he was putting himself through a course on quantum mechanics.
3184,0.0,"all night, while he charged up, he contemplated the mathematics and the basic texts."
3185,0.5,"he read schrodinger's dublin lectures, what is life?, from which he concluded that he was alive."
3186,1.0,"he read the transcript of the celebrated 1927 solvay conference, when the luminaries of physics met to discuss photons and electrons."
3187,0.6,i was at breakfast.
3188,-1.0,"i told him i would once read that the elderly einstein, while at princeton in his final years, started each day with eggs fried in butter and that in adam's honour, i was frying two now for myself."
3189,0.0,"adam said, ""people said he never grasped what he himself had started."
3190,-0.6,solvay was a battlefield for him.
3191,-0.09999999999999998,"outnumbered, poor fellow."
3192,1.15,by extraordinary young men.
3193,-0.5,but that was unfair.
3194,-0.19999999999999996,"the young turks were not concerned with what nature is, only with what one could say about it."
3195,0.0,whereas einstein thought there was no science without belief in an external world independent of the observer.
3196,-1.35,"he did not think quantum mechanics was wrong so much as incomplete."""
3197,0.25,this after one night's study.
3198,-0.09999999999999998,"i remembered my hopeless brief entanglement with physics at college, before i found safety in anthropology."
3199,-0.75,"i suppose i was a little jealous, especially when i learned that adam had got his mind round dirac's equation."
3200,2.0,i cited richard feynman's remark that anyone who claims to understand quantum theory does not understand quantum theory.
3201,0.0,"adam shook his head. """
3202,-1.5499999999999998,"a bogus paradox, if it is even a paradox at all."
3203,1.0,"tens of thousands understand it, millions make use of it."
3204,0.0,"it is a matter of time, charlie."
3205,0.0,general relativity was once at the outer edge of difficulty.
3206,0.0,now it is routine for firstyear undergraduates.
3207,0.0,the same was true of the calculus.
3208,0.0,now fourteen-year-olds can do it.
3209,0.0,"one day quantum mechanics will pass into common sense."""
3210,0.0,by this time i was eating my eggs.
3211,0.0,adam had made the coffee.
3212,0.5,it was far too strong.
3213,0.0,"i said, ""ok."
3214,0.0,what about that solvay question?
3215,0.8,"is quantum mechanics a description of nature or just an effective way of predicting things?"""
3216,0.25,"i do not understand the doubt about it,"" he said."
3217,-0.75,"to creatures of our immense size, the material world looks blurred and feels hard."
3218,0.25,but now we know how strange and wonderful it is.
3219,1.0,"so it should not surprise us that consciousness, your sort and mine, could arise from an arrangement of matter"
3220,0.0,and we do not have anything else to explain how matter can think and feel.
3221,0.0,"but then, beams can be investigated."""
3222,-0.25,"another morning, after he had told me how he had been thinking all night of miranda, he said, ""i have also been thinking about vision and death."""
3223,0.0,we can not see behind our heads.
3224,0.0,we can not even see our chins.
3225,0.5,"let us say our field of vision is almost 180 degrees, counting in peripheral awareness."
3226,-0.25,"the odd thing is, there is no boundary, no edge."
3227,0.75,"there is not vision and then blackness, like you get when you look through binoculars."
3228,0.0,"there is not something, then nothing."
3229,0.5,"what we have is the field of vision, and then beyond it less than nothing."""
3230,0.0,less than nothing.
3231,-0.25,less than blackness.
3232,1.65,the edge of vision is a good representation of the edge of consciousness.
3233,-0.75,"life, then death."
3234,0.0,"it is a foretaste, charlie, and it is there all day."""
3235,-0.75,"he raised both hands as if to grip and shake a trophy. """
3236,0.8,exactly right!
3237,-0.75,"less than nothing to be afraid of!"""
3238,-1.75,was he covering for an anxiety about death?
3239,0.0,his term was fixed for approximately twenty years.
3240,0.0,"when i asked, he said, ""that is the difference between us, charlie."
3241,0.75,my body parts will be improved or replaced.
3242,0.6,"but my mind, my memories, experiences, identity and so on will be uploaded and retained."
3243,0.0,"they will be of use."""
3244,1.25,poetry was another instance of his exuberance in love.
3245,1.8,"he had written 2,000 haikus and had recited about a dozen, of the same quality, each one devoted to miranda."
3246,1.9,i would been interested at first in learning what adam could create.
3247,-0.25,but i soon lost interest in the form itself.
3248,1.3,"too cute, too devoted to not making much sense, too undemanding of their author as they played on empty mysteries of the sound-of-one-hand-clapping sort."
3249,0.0,two thousand!
3250,0.0,the figure made my point--an algorithm was churning them out.
3251,0.5,i said all this as we walked the backstreets of stockwell--our daily exercise to extend adam's social skills.
3252,0.0,"we would been into shops, pubs and had even taken a trip on the tube to green park and sat on the grass among the lunchtime crowds."
3253,-1.0,perhaps i was too harsh.
3254,-0.5,"haikus, i told him, could be stifling in their stillness."
3255,1.0,but i was also encouraging.
3256,0.0,time to move on to another form.
3257,0.0,he had access to all the world's literature.
3258,0.0,"why not attempt a poem with verses of four lines, rhyming or not?"
3259,0.1,or even a short story and eventually a novel?
3260,0.0,early that evening he gave me his response.
3261,-1.0,"i was not long out of the shower, freshly dressed and on my way upstairs, therefore a little impatient."
3262,0.0,"on the table, waiting to come with me, was a bottle of pomerol."
3263,0.0,there was a conversation i needed to have with miranda.
3264,0.0,gorringe was due to be released in seven weeks.
3265,0.0,we still had not decided what to do.
3266,-0.25,there was an assumption that adam could act as her bodyguard
3267,-0.75,and i was worried
3268,-0.25,she had been back to the local police station.
3269,-0.75,the detective who had visited gorringe in prison had moved on.
3270,-1.25,the desk sergeant had taken a note and advised her to phone emergency in the event of trouble.
3271,-0.5,she had suggested that it might be difficult if she was being bludgeoned at the time.
3272,-1.0,the sergeant did not take this to be facetious.
3273,0.0,he advised her to make the call before that eventuality.
3274,0.8,yes.
3275,0.0,"and do not open the door."""
3276,-0.75,she had seen a solicitor about going before a judge to get an exclusion order.
3277,2.25,success was not certain and it was not clear what it would achieve.
3278,0.0,she had asked her father not to divulge her address to anyone.
3279,-1.0,but maxfield had worries of his own and she thought he would forget.
3280,-0.85,we were left with the hope that the threat was not serious and that adam would be a deterrent.
3281,-1.25,"when i asked her how dangerous gorringe really was, she said, ""he is a creep."""
3282,0.8,i was not in the right mood for another conversation with adam about poetry.
3283,1.0,i want to refine and extend the form.
3284,0.5,everything i have done so far is a kind of limbering up.
3285,0.0,my juvenilia.
3286,0.35,"when i have studied the masters and understood more, especially when i have grasped the power of the kireji, the cutting word that separates the two juxtaposed parts, my real work can begin."""
3287,0.0,from upstairs i heard the phone ring and miranda's footsteps across my ceiling.
3288,2.0,"adam said, ""as a thinking man with an interest in anthropology and politics, you will not be much interested in optimism."
3289,-0.85,"but beyond the currents of disheartening facts about human nature and societies and daily bad news, there can be mightier stirrings, positive developments that are lost to view."
3290,0.5,"the world is so connected now, however crudely, and change is so widely distributed that progress is hard to perceive."
3291,1.3,"i do not like to boast, but one of those changes is right in front of you."
3292,1.0,"the implications of intelligent machines are so immense that we have no idea what you--civilisation, that is--have set in motion."
3293,-2.75,one anxiety is that it will be a shock and an insult to live with entities that are cleverer than you are.
3294,0.0,but already almost everyone knows someone cleverer than themselves.
3295,0.5,"on top of which, you underestimate yourselves."""
3296,0.0,i could make out miranda's voice on the phone.
3297,-0.5,she was agitated.
3298,0.0,she was walking up and down her sitting room as she spoke.
3299,0.0,adam appeared not to hear her
3300,0.0,but i knew he had.
3301,0.5,"as a species, you are far too competitive."
3302,0.85,even now there are paralysed patients with electrodes implanted in the motor strip of their brains who merely think of the action and can raise an arm or bend a finger.
3303,0.9,this is a humble beginning and there are many problems to solve.
3304,2.75,"they will certainly be solved, and when they are, and a brain--machine interface is efficient and cheap, you will become a partner with your machines in the open-ended expansion of intelligence, and of consciousness generally."
3305,0.8500000000000001,"colossal intelligence, instant access to deep moral acumen and to everything known, but more importantly, access to each other."""
3306,0.0,miranda's pacing upstairs had ceased.
3307,0.5,you will probably come to value it less in the face of the enormous gains.
3308,0.0,you might be wondering what relevance any of this has to the haiku.
3309,0.0,it is this.
3310,0.0,"ever since i have been here, i have been surveying the literature of scores of countries."
3311,1.0,"magnificent traditions, gorgeous elaborations of--"
3312,0.6,"her bedroom door closed, steps swiftly crossed her sitting room to her door."
3313,0.0,it slammed shut
3314,0.0,and i heard her footsteps on the stairs.
3315,0.0,her key was in my door
3316,0.0,and then she was before us.
3317,0.0,her face had a greasy shine.
3318,0.9,she was doing her best to keep a level voice.
3319,0.0,that was my father on the phone.
3320,0.0,they let gorringe out early.
3321,0.0,three weeks ago.
3322,0.0,"he is been to salisbury, to the house, talked his way past the housekeeper and got my address out of my father."
3323,0.0,"he could be on his way here now."""
3324,0.0,she lowered herself into the nearest kitchen chair.
3325,0.0,i too sat down.
3326,0.0,adam took in miranda's news and nodded.
3327,0.0,but he pressed on into our silence.
3328,2.85,"nearly everything i have read in the world's literature describes varieties of human failure--of understanding, of reason, of wisdom, of proper sympathies."
3329,-1.75,"failures of cognition, honesty, kindness, self-awareness; superb depictions of murder, cruelty, greed, stupidity, self-delusion, above all, profound misunderstanding of others."
3330,4.75,"of course, goodness is on show too, and heroism, grace, wisdom, truth."
3331,1.15,"out of this rich tangle have come literary traditions, flourishing, like the wild flowers in darwin's famous hedgerow."
3332,1.0,"novels ripe with tension, concealment and violence as well as moments of love and perfect formal resolution."
3333,1.9000000000000001,"but when the marriage of men and women to machines is complete, this literature will be redundant because we will understand each other too well."
3334,0.6,we will inhabit a community of minds to which we have immediate access.
3335,-0.5,"connectivity will be such that individual nodes of the subjective will merge into an ocean of thought, of which our internet is the crude precursor."
3336,-1.75,"as we come to inhabit each other's minds, we will be incapable of deceit."
3337,-0.75,our narratives will no longer record endless misunderstanding.
3338,0.0,our literatures will lose their unwholesome nourishment.
3339,1.0,"the lapidary haiku, the still, clear perception and celebration of things as they are, will be the only necessary form."
3340,-0.25,"i am sure we will treasure the literature of the past, even as it horrifies us."
3341,0.8499999999999999,"we will look back and marvel at how well the people of long ago depicted their own shortcomings, how they wove brilliant, even optimistic fables out of their conflicts and monstrous inadequacies and mutual incomprehension."""
3342,-1.0,"adam's utopia masked a nightmare, as utopias generally do, but it was a mere abstraction."
3343,-1.0,miranda's nightmare was real and instantly became mine.
3344,-1.55,"we sat beside each other at the table, flustered and dumb, a rare combination."
3345,1.4,it was left to adam to be clear-headed and set out the reassuring facts.
3346,0.0,nothing maxfield had said on the phone indicated that gorringe was on his way here tonight.
3347,0.35,"if he would been out three weeks, murder was clearly not his priority."
3348,0.0,"he could arrive tomorrow, or next month, or never."
3349,-0.25,"if he hoped to succeed without witnesses, he would have to kill all three of us."
3350,-1.5,he would be an obvious suspect in any crime against miranda.
3351,-0.75,"even if he came this evening, he would find miranda's flat in darkness."
3352,0.0,he knew nothing about her connection with me.
3353,-1.5,it was likely that the threat itself was all the punishment he intended.
3354,0.4,"finally, we had a strongman on our side."
3355,-0.25,"if necessary, he could keep gorringe talking while one of us called the police."
3356,0.0,time to open the wine!
3357,0.0,adam set three glasses on the table.
3358,1.3,miranda preferred my father's edwardian teak-handled corkscrew to my fancy gadget with a lever.
3359,0.0,the effort seemed to settle her.
3360,0.0,the first glass settled me.
3361,0.5,"to keep us company, adam sipped at a third of a glass of warm water."
3362,-1.0,"our fears were not quite dispelled but now, in this party atmosphere, we returned to adam's little thesis."
3363,-0.15,"we even raised a toast to ""the future,"" though his version of it, private mental space drowned by new technology in an ocean of collective thought, repelled us both."
3364,2.0,"fortunately, it was as feasible as the project of implanting the brains of billions."
3365,0.5,"i said to adam, ""i would like to think that there will always be someone, somewhere, not writing haikus."""
3366,0.0,we raised our glasses to that too.
3367,-0.8,no one was in the mood for an argument.
3368,0.0,the only other possible topic was gorringe and everything related to him.
3369,-0.25,that conversation was just starting when i excused myself and went to the bathroom.
3370,1.2,"as i was washing my hands, i found myself thinking about mark and my fleeting sense of privilege in the playground when he put his hand in mine."
3371,1.0,i remembered his look of resilient intelligence.
3372,0.6,"i thought of him not as a child, but as a person in the context of his entire life."
3373,0.5,"his future was in the hands of bureaucrats, however kindly, and the choices they made for him."
3374,-0.25,he could easily sink.
3375,-0.5,miranda had so far been unable to get news of him.
3376,0.7000000000000002,"finding jasmin, or any social worker willing to talk to her, was impossible."
3377,-0.19999999999999996,"there were, she was told at last by someone in the right department, issues of confidentiality."
3378,-1.2,"despite that, she learned that the father had vanished and the mother had drink and drug problems."
3379,0.0,as i was returning to the kitchen
3380,0.0,"i had a moment of nostalgia for my life as it was before gorringe, adam, even miranda."
3381,-0.5,"as an existence, it had been insufficient but relatively simple."
3382,1.0,simpler still if i would left my mother's money in the bank.
3383,2.05,"here was my lover at the table, beautiful and outwardly composed."
3384,-0.75,"as i sat down, it was not irritation"
3385,0.0,"i felt towards her, though that was not far off."
3386,-0.09999999999999998,more like detachment.
3387,-1.25,"i saw what must have been obvious to everyone--her secretiveness; also, her inability to ask for help, her trick of getting it anyway, and of never being held to account."
3388,0.0,"i sat down, drank a little wine, listened to the conversation--and made a decision."
3389,-1.25,"setting aside adam's reassurances, i believed she had brought a murderer into my life."
3390,0.0,"i was expected to help, and i would."
3391,0.0,but she had told me nothing.
3392,-0.75,now i was calling in a debt.
3393,0.8,we were looking right at each other.
3394,0.0,"i could not keep the terseness out of my voice. """
3395,-1.0,"did he rape you or not?"""
3396,-0.25,"after a pause, during which she continued to hold my gaze, she shook her head slowly from side to side"
3397,0.0,"and then she said softly, ""no."""
3398,0.0,i waited.
3399,0.0,she waited.
3400,0.0,adam went to speak.
3401,-1.0,i silenced him with a slight shake of the head.
3402,0.5,when it was clear that miranda was not going to say more---
3403,-0.5,"the very reticence that was oppressing me--i said, ""you lied to the court."""
3404,0.0,she sighed.
3405,0.0,"again, i waited."
3406,0.5,"my patience was running out, but i did not raise my voice. """
3407,0.0,miranda.
3408,-1.0,this is stupid.
3409,0.0,what happened?
3410,0.5,"to my relief, she said, as though to herself, ""it will take a while."""
3411,0.0,she began without preamble.
3412,0.75,suddenly she seemed eager to tell her story.
3413,0.6,she was brought into the classroom and introduced as mariam.
3414,1.15,"she was slender and dark, with beautiful eyes and the blackest hair you would ever seen, tied with a white ribbon."
3415,0.4,salisbury was a very white town back then
3416,0.6,so we were all fascinated by this girl from pakistan.
3417,-0.25,"i could see that standing there, in front of the class, being stared at by everyone, was hard for her."
3418,-0.75,it was as if she was in pain.
3419,1.85,"when our teacher asked who wanted to be mariam's special friend and show her around and help her, i was the first to put up my hand."
3420,0.25,the boy sitting with me was moved to another desk
3421,0.0,and she took his place.
3422,0.0,"we sat together in class for years to come, in that school and the next."
3423,0.0,"at some point during our first day, she put her hand in mine."
3424,0.0,"lots of us girls were always doing that, but this was different."
3425,1.2,her hand was so delicate and smooth
3426,-0.75,"and she was so quiet, so tentative."
3427,1.15,"i was pretty shy myself, so i was drawn to her quietness and intimacy."
3428,0.65,"she was far more timid than me, at least at first, and i think she made me feel for the first time confident and knowing."
3429,0.25,i fell in love with her.
3430,0.6,i introduced her to my friends.
3431,-1.0,i do not remember any racism.
3432,-0.09999999999999998,"the boys ignored her, the girls were kind to her."
3433,1.1,they liked to finger her brightly coloured dresses.
3434,-1.5,"she was so unusual, exotic even, and i used to worry that someone would steal her from me."
3435,1.8,but she was a very loyal friend.
3436,0.0,we kept hold of each other's hand.
3437,0.0,"within a month, she took me home to meet her family."
3438,-0.15000000000000002,"knowing that i would lost my mother when i was little, mariam's mother, sana, took me in."
3439,0.0,she was kind but rather bossy in an affectionate way.
3440,0.0,one afternoon she brushed out my hair and tied in one of mariam's ribbons.
3441,0.0,no one had ever done that for me before.
3442,-1.5,"i was overwhelmed and i cried."""
3443,0.4,the memory had caused her throat to constrict and her voice to become lighter.
3444,-0.25,she paused and swallowed hard before starting again.
3445,0.5,"there was a little sister, surayya, whom mariam adored, and two older brothers, farhan and hamid."
3446,0.75,"her father, yasir, worked for the local authority as a water engineer."
3447,0.5,he was very nice to me too.
3448,-0.5000000000000001,"it was a crowded, noisy household, very friendly, argumentative, the complete opposite of my own."
3449,0.0,"they were religious, muslim of course, but at that age i was hardly aware of it."
3450,0.5,"later i took it for granted, and by then i was a part of the family."
3451,0.0,"when they went to the mosque, it never crossed my mind to go with them, or even ask about it."
3452,0.5,i would grown up without religion and i had no interest in it.
3453,0.0,mariam was transformed as soon as she was through her front door.
3454,1.0,she became playful and far more talkative.
3455,0.0,she was her father's favourite.
3456,0.75,she liked to sit on his knee when he came in from work.
3457,-0.75,i was a tiny bit jealous.
3458,-1.6,"just outside the cathedral close, tall, thin, early victorian, untidy, dark, piles of books."
3459,0.5,my father was always loving but he spent most of his time in his study and did not like to be disturbed.
3460,0.0,a local lady came in to cook my tea.
3461,0.5,"so we were on our own, and we liked that."
3462,-0.15000000000000002,"we made a den in an attic room, we had adventures in our overgrown garden."
3463,0.0,we watched tv together.
3464,-0.6,"a couple of years later, we clung to each other in the first bewildering days of secondary school."
3465,0.0,we did our homework together.
3466,1.05,she was far better at maths and good at explaining problems.
3467,0.8,i helped her with her written english.
3468,-1.0,she was hopeless at spelling.
3469,-0.25,"as time passed and we became more self-conscious, we spent hours talking about our families."
3470,0.0,we had our first periods within a few weeks of each other.
3471,1.55,her mother was really sensible and helpful with that.
3472,0.0,"we also talked about boys, although we did not go near them."
3473,-1.5,"because of her brothers, she was less bothered, more sceptical about boys than i was."
3474,0.0,our last summer at school came around.
3475,0.6,we sat our public exams and thought about university.
3476,0.0,she wanted to do science
3477,-0.75,"we were worried that we would end up in different places."""
3478,-0.4,miranda stopped.
3479,-0.25,she took a long slow breath.
3480,0.0,"as she resumed, she reached for my hand."
3481,-0.75,she was in a very bad state.
3482,0.0,at first i could not make out what she was saying.
3483,0.0,she wanted to meet me in a local park.
3484,0.0,"when i got to her, she could not speak."
3485,-0.25,"we walked around the park, arm in arm, and all i could do was wait."
3486,0.0,at last she told me what had happened the day before.
3487,0.0,her route home from school took her by some playing fields.
3488,0.0,it was dusk
3489,-0.7,and she was hurrying because her parents did not like her out alone after dark.
3490,0.0,she became aware of a figure following her.
3491,0.0,it seemed to be getting closer each time she turned to look.
3492,-0.6,she thought of breaking into a run--
3493,1.0,she was fast--
3494,-0.25,then decided she was being silly.
3495,0.0,and she had a satchel full of books.
3496,0.0,the person following her was getting closer.
