1512,0.0,simon was taller and he usually reached up for me.
1513,0.0,a single word brought adam to life.
1514,0.0,"with the faintest whirring sound, which i hoped only i could hear, he turned to address simon in formal terms."
1515,0.0,there is a coincidence.
1516,-0.15000000000000002,i have been giving some thought lately to the mystery of the self.
1517,0.4,some say it is an organic element or process embedded in neural structures.
1518,-0.5,"others insist that it is an illusion, a by-product of our narrative tendencies."""
1519,1.05,"there was a silence, then, stiffening a little, simon said, ""well, sir, which is it?"
1520,0.0,"what have you decided?"""
1521,0.5,i am bound to conclude that i have a very powerful sense of self
1522,0.4,and i am certain that it is real and that neuroscience will describe it fully one day.
1523,0.8,"even when it does, i will not know this self any better than i do now."
1524,-0.75,"but i do have moments of doubt when i wonder whether i am subject to a form of cartesian error."""
1525,-0.25,by this time i had the journal in my hands and was preparing to leave.
1526,0.5,i would like to meet one.
1527,0.0,"do you know any?"""
1528,-0.25,simon was emphatic.
1529,0.25,"no, sir."
1530,0.0,"absolutely, i do not."""
1531,0.6,"i raised a hand in farewell and thanks and, taking adam by his elbow, guided him towards the door."
1532,-0.050000000000000044,"it was a cliche of romantic love, but no less painful for that: the stronger my feelings, the more remote and unattainable miranda appeared."
1533,-0.15000000000000002,"how could i complain when she was attained that very first night, after dinner?"
1534,0.75,we had fun
1535,-0.75,"but i was greedy for more, though i tried not to show it."
1536,0.4,"i wanted her to open up to me, to want me, need me, show some hunger for me, some delight in me."
1537,0.1,"instead, my initial impression held--"
1538,-0.25,she could take me or leave me.
1539,1.95,"everything good that passed between us--sex, food, movies, new plays--was instigated by me."
1540,-0.5,"without me she drifted in silence towards her default condition upstairs, to a book on the corn laws, a bowl of cereal, a cup of weak herbal tea, curled up in an armchair, barefoot and oblivious."
1541,0.0,sometimes she sat for long periods without a book.
1542,-0.65,"if i put my head round her door (we now had keys to each other's places) and said, ""how about an hour of frantic sex?"
1543,0.0,when we were done she would take a shower and return to her chair.
1544,0.0,unless i suggested something else.
1545,0.4,"a glass of wine, a risotto, an almost famous sax player at a stockwell pub."
1546,0.0,ok again.
1547,1.75,"to everything i proposed, indoors or out, she brought the same tranquil readiness."
1548,0.75,happy to hold my hand.
1549,1.0,"but there was something, or many things, i did not understand, or she did not want me to know about."
1550,0.35,"whenever she had a seminar or needed to use the library, she returned from college in the late afternoons."
1551,0.0,once a week she came back later.
1552,0.0,it took me a while to notice that it was always a friday.
1553,0.4,finally she told me that she went to the regent's park mosque for friday prayers.
1554,0.0,that surprised me.
1555,-0.1,"but no, she was not thinking of converting from atheism."
1556,0.0,she had in mind a social-history paper she might write.
1557,0.6,"i was not convinced, but i let it go."
1558,0.9,what we lacked was conversational intimacy.
1559,-0.85,we were closest when we argued about the task force.
1560,0.4,"when we went to a bar, her conversation was general."
1561,1.5,"she was happy with her solitude or with lively chat about public matters, but there was nothing personal in between, except her father's health or his literary career."
1562,2.6,"when i tried to ease us towards the past, perhaps angling in gently with something about myself or a question about her own history, she reached quickly for generalities or an account of the earliest years of her childhood, or an anecdote about someone she knew."
1563,-2.4,"i told her about my idiotic excursion into tax fraud, my experience of court and the tedium of my hours of community service."
1564,0.0,"i would have told her anyway, but the story was my pretext to ask if she herself had ever been in court."
1565,-0.25,the answer was abrupt.
1566,0.0,never!
1567,0.0,and then she changed the subject.
1568,2.0,"i would been in various promising affairs and in love, or almost in love, two or three times before, depending on definitions."
1569,0.8999999999999999,i fancied myself an expert and knew better than to put her under pressure.
1570,0.0,i still thought i might get more out of adam on the salisbury affair.
1571,0.0,"if i did not know her secret, at least she did not know i knew she had one."
1572,0.4,tact was everything.
1573,0.30000000000000004,"i still had not told her that i loved her, or divulged my fantasies about our shared future or even hinted at my frustration."
1574,-0.6,i left her alone with her books or her thoughts whenever it suited her.
1575,1.25,"though the subject was not in the line of my interests, i worked up an acquaintance with the corn laws and developed some ideas of my own about free trade."
1576,0.5,"she did not dismiss them, but nor was she impressed."
1577,0.6,"so here we were upstairs at dinner in her kitchen, which was even smaller than mine."
1578,0.25,"the table was of white moulded plastic, just big enough for two, probably stolen from a pub garden by a previous tenant."
1579,-0.25,"standing at the sink, up to his elbows in suds, adam dealt with the plates and cutlery"
1580,-1.0,"we would handed him at the end of our meal--toad-in-the-hole, baked beans, fried eggs."
1581,0.4,student food.
1582,-1.0,"on the windowsill, where yellow gingham curtains hung still in our late-summer heat wave, a radio was playing the beatles, recently regrouped after twelve years apart."
1583,-2.35,"their album, love and lemons, had been derided for its grandiosity, for failing to resist the lure and overreach of an eighty-strong symphony orchestra."
1584,1.4,"they could not master such forces, was the general drift, with half a lifetime's store of guitar chords."
1585,0.050000000000000044,"nor did we wish to be told again, the times critic complained, that love was all we needed, even if it were true, which it was not."
1586,2.3499999999999996,"but i liked the music's muscular sentimentality, emptied of irony by these middle-aged performers, so confident and tuneful, liberated by useful ignorance of two and a half centuries of symphonic experimentation."
1587,-0.25,"lennon's rasping voice floated towards us from some faraway echoing place beyond the horizon, or the grave."
1588,0.75,i did not mind being told again about love.
1589,0.5,"here before me were all of its warm possibilities, barely three feet away, and it was all i needed."
1590,2.0,"here was her long, exquisitely shaped face (those angled cheekbones might break through the skin one day), the amused gaze, at this point still merry, and narrowed, locked on me, the lips parted, for she was about to speak against what i would just said."
1591,0.9500000000000001,her perfect elongated nose flared faintly at the base of the nostrils' arch to signal in advance her dissent.
1592,-0.75,"her pallor set off her fine brown hair, tonight childishly parted dead centre."
1593,0.6,"against prevailing fashion, she kept out of the sun."
1594,0.4,her bare white arms were also thin and unblemished--not a single freckle.
1595,0.5,"from my point of view we still holidayed in the foothills, among possibilities whose fulfilment rose like distant alps."
1596,-0.75,i tried to ignore them in order to attend to details.
1597,-0.8,"from her perspective, on the other side of this frail table, we may have already reached our highest point."
1598,0.0,"she may have thought she was as close as she ever wanted to be, or could be, to another person."
1599,1.25,love stories like jane austen's used to conclude chastely with preparations for a wedding.
1600,1.25,"now their climax lay on the far side of carnal knowledge, where all of complexity waited."
1601,-1.3,"for now, my business was to conduct a political argument with her without feelings running high, then turning sour, and at the same time stay true to myself and let her do the same."
1602,-0.09999999999999998,"it was a feasible balancing act, as long as i drank less than half a bottle of the indifferent medoc that stood between us."
1603,0.8,"we would had this conversation before and it should have been easier now, but repetition seemed like an indictment of us both."
1604,0.0,we did not really want to be talking about it.
1605,-0.75,"impossible to avoid, even though we knew it would lead nowhere."
1606,0.0,but this was how it was for everyone.
1607,-0.5,we were all still tending the wound.
1608,0.09999999999999998,how could miranda and i spend our lives together when we could not agree on such a fundamental as war?
1609,0.0,about the islands formerly known as the falklands she had firm views.
1610,0.0,she insisted that the argentine flag-planting on remote south georgia had been a clear violation of international law.
1611,-1.75,i said it was an inhospitable place and no one should be asked to fight to the death for it.
1612,-0.9,she said that the taking of port stanley was the desperate act of an unpopular regime looking to whip up patriotic fervour.
1613,0.6,i said this was all the more reason not to get drawn in.
1614,-0.09999999999999998,"she said the task force was a brave and brilliant conception, even in failure."
1615,-1.75,"i said, uneasily remembering my emotional state when the ships set off, that it was a ridiculous enactment of lost imperial grandeur."
1616,-0.5,"how could i not see, she said, that this was an antifascist war?"
1617,-0.75,"no (i spoke over her), it was a row over property, fed on each side by nationalistic stupidity."
1618,-0.8,i summoned the borges observation: two bald men fighting over a comb.
1619,0.0,she replied that a bald man might hand down his comb to his children.
1620,-1.35,"i was struggling to understand this when she added that the generals had tortured, disappeared and killed their citizens by the thousands and were running the economy into the ground."
1621,-0.35,"if we would taken back the islands, the humiliation would have finished the military regime and democracy would have returned to argentina."
1622,0.0,i replied that she could not possibly know this.
1623,-0.6,we had lost thousands of young men and women to the because of mrs. thatcher's ambitions.
1624,0.0,my voice began to rise before i remembered.
1625,-1.75,i resumed quietly but with a certain tremor: that she remained in office after such slaughter was the greatest political scandal of our time.
1626,3.25,"i delivered this with a finality that deserved a moment's respectful silence, but miranda came straight back to tell me that the prime minister failed in a decent because and was supported by almost all of parliament and the country and she was right to remain in office."
1627,0.25,"during this conversation, adam finished with the dishes and stood with his back to the kitchen sink to watch us, arms folded, his head turning from side to side, speaker to speaker, like a spectator at a tennis match."
1628,-0.5,"our exchange was not exactly weary, but repetition had given it an air of ritual."
1629,0.25,"like facing armies, we would taken up our positions and intended to hold them."
1630,-0.35,miranda was telling me that the task force set off without proper ship-to-air missiles.
1631,0.0,the chiefs of staff let the armed forces down.
1632,0.25,"i used to hear terms like these--ship-toair, homing devices, titanium-tipped--at the warwickshire student union bar, but only from men, men of the political left, whose opinions were complicated by tacit admiration for the weapon systems they condemned."
1633,2.5,"in her soft and fluent delivery, she mingled these with other concepts from the lexicon of established power--the open society, rule of law, restoration of democracy."
1634,0.0,perhaps it was her father i was hearing.
1635,0.0,"while she was speaking, i turned to catch adam's expression."
1636,1.05,what i saw was his devoted attention.
1637,0.0,more than that.
1638,1.0,a look of delight.
1639,0.5,he adored what she was saying.
1640,-0.6,"i turned back to miranda as she reminded me that the falklanders were my fellow citizens, now living under fascism."
1641,0.75,was i happy with that?
1642,-1.75,i disliked this rhetorical turn.
1643,-1.0,it was a masked insult.
1644,-0.5,"the conversation was turning sour, just as i would feared, but i could not help myself."
1645,-0.75,"in the tiny kitchen space, i was hot and irritable as i reached for the wine and filled my glass."
1646,0.0,"there could have been a negotiated settlement, i started to say."
1647,0.75,"a slow and painless thirty-year transition, a un mandate, guaranteed rights."
1648,-1.25,she interrupted to inform me that we could never trust any undertaking by the murdering generals.
1649,-0.35,"as she said it, i saw them in caricature, in braided hats, campaign ribbons, cavalry boots, and galtieri on his white horse in a confetti blizzard on the avenida 25 de mayo."
1650,0.8,i said that i accepted every last one of her arguments.
1651,-1.0,"the forces set off on their 8,000-mile mission, her risky strategy was tested and it failed."
1652,-3.15,"thousands she never knew or cared about were drowned or burned to death, or live on, maimed, disfigured, traumatised."
1653,-1.6,we have arrived at the worst outcome: the junta possessed the island and its inhabitants.
1654,-1.75,"whereas a policy of slow, negotiated agreement was not tested, but if it had failed we would have reached the same outcome, without the agony and death."
1655,0.0,we could not know.
1656,-0.75,what might have happened was lost to us.
1657,-0.5,so what was there to argue about?
1658,-0.25,"i saw that the glass i would filled, and had no memory of touching, was empty."
1659,-0.75,and i was wrong.
1660,-0.5,"there was plenty to argue about, for"
1661,0.0,"even as i said it, i knew i was crossing a line."
1662,-2.25,"i had accused her of not caring about the dead, and she was angry."
1663,0.0,"her eyes were narrowed, without merriment, but she did not address my transgression."
1664,0.0,"instead, she turned to adam and asked quietly, ""what is your view?"""
1665,0.0,his gaze travelled from her to me and back.
1666,0.0,i still did not know whether he actually saw anything.
1667,0.0,"an image on some internal screen that no one was watching, or some diffused circuitry to orient his body in three-dimensional space?"
1668,-1.25,"seeming to see could be a blind trick of imitation, a social manoeuvre to fool us into projecting onto him a human quality."
1669,0.5,"but i could not help it: when our eyes briefly met and i looked into the blue irises flecked with spears of black, the moment appeared rich with meaning, with anticipation."
1670,-0.25,"i wanted to know whether he understood, as i did, and as miranda surely did, that the issue here was loyalty."
1671,1.35,"his tone was prompt and calm. """
1672,-0.6,"invasion, success or failure."
1673,0.0,"negotiated settlement, success or failure."
1674,0.0,four outcomes or effects.
1675,0.25,"without benefit of hindsight, we would have to choose which causes to pursue, which to avoid."
1676,0.0,we would be in the realm of bayesian inverse probability.
1677,0.0,we would be looking for the probable because of an effect rather than the most likely effect of a because.
1678,0.8,"only sensible, to try and find a formal representation of our guesswork."
1679,0.0,"our reference point, our datum, would be an observer of the falklands situation before any decisions were taken."
1680,0.0,certain a priori probability values are ascribed to the four outcomes.
1681,0.9,"as fresh information comes in, we can measure relative changes in probability."
1682,-0.25,but we can not possess an absolute value.
1683,0.8,"it may help us to define the weight of new evidence logarithmically, so that, assuming a base"
1684,0.0,"ten--"""
1685,-0.25,enough!
1686,0.0,really.
1687,-0.75,"what nonsense!"""
1688,0.0,now it was miranda who reached for the medoc.
1689,-0.75,i was relieved to be no longer the object of her irritation.
1690,0.4,"i said, ""but miranda and i would ascribe completely different a priori values."""
1691,0.0,adam turned his head towards me.
1692,-0.25,"as always, too slowly. """
1693,0.0,of course.
1694,-0.25,"as i said, when describing the future there can be no absolute values."
1695,0.0,"only shifting degrees of likelihood."""
1696,0.4,ultimately bayes reflects a state of mind.
1697,0.0,"as does all of common sense."""
1698,1.4,"then nothing was solved, despite this high gloss of rationality."
1699,0.0,miranda and i had different states of mind.
1700,0.8,what was new?
1701,0.5,but we were united against adam in our differences.
1702,0.5,"at least, this was my hope."
1703,3.5000000000000004,"he may have understood the relevant issue after all: he thought i was right about the falklands and, given a degree of programmed intellectual honesty, the best he could offer miranda, to whom he was also loyal, was an appearance of neutrality."
1704,1.8,"but if that was sound, why not accept the mirror possibility, that he believed miranda was right"
1705,1.5,and i was the one in receipt of loyal support?
1706,-0.25,"with a sudden scrape of a kitchen chair, miranda stood."
1707,-1.2000000000000002,there was a faint flush about her face and throat
1708,0.0,and she was not looking at me.
1709,0.0,we would be sleeping in separate beds that night.
1710,-0.55,i would have happily unsaid my entire argument to stay with her.
1711,-0.75,but i was dumb.
1712,0.5,"she said to adam, ""you can stay up here to charge, if you like."""
1713,0.0,adam needed six hours a night connected to a thirteenamp socket.
1714,0.6,"he went into sleep mode and sat quietly ""reading"" until after dawn."
1715,0.0,"usually he was in my kitchen downstairs, but recently miranda had bought a second charging cable."
1716,-0.65,"he murmured his thanks and slowly folded a kitchen towel in half with close attention, hunched over the task, and spread it across the draining board."
1717,0.95,"as she moved towards her bedroom door she shot me a look, a regretful smile that did not part her lips, sent a conciliatory kiss across the space between us and whispered, ""just for tonight."""
1718,0.25,so we were fine.
1719,0.0,"i said, ""of course i know you care about the dead."""
1720,0.0,she nodded and left.
1721,0.5,"adam was sitting down, pulling his shirt clear of his belt to locate the tethering point below his waistline."
1722,0.0,i put a hand on his shoulder and thanked him for clearing up.
1723,0.0,"for me, it was far too early for bed"
1724,0.25,"and it was hot, like a summer evening in marrakech."
1725,0.75,i went downstairs and looked in the fridge for something cool.
1726,0.4,"i remained in the kitchen, in an old leather armchair, with a balloon glass of moldovan white."
1727,0.0,there was much pleasure in following a line of thought without opposition.
1728,0.0,"i was hardly the first to think it, but one could see the history of human self-regard as a series of demotions tending to extinction."
1729,2.05,"once we sat enthroned at the centre of the universe, with sun and planets, the entire observable world, turning around us in an ageless dance of worship."
1730,-0.4,"then, in defiance of the priests, heartless astronomy reduced us to an orbiting planet around the sun, just one among other rocks."
1731,2.2,"but still we stood apart, brilliantly unique, appointed by the creator to be lords of everything that lived."
1732,-0.09999999999999998,"then biology confirmed that we were at one with the rest, sharing common ancestry with bacteria, pansies, trout and sheep."
1733,-0.65,"in the early twentieth century came deeper exile into darkness when the immensity of the universe was revealed and even the sun became one among billions in our galaxy, among billions of galaxies."
1734,1.15,"finally, in consciousness, our last redoubt, we were probably correct to believe that we had more of it than any creature on earth."
1735,0.5,but the mind that had once rebelled against the gods was about to dethrone itself by way of its own fabulous reach.
1736,0.0,"in the compressed version, we would devise a machine a little cleverer than ourselves, then set that machine to invent another that lay beyond our comprehension."
1737,0.0,what need then of us?
1738,0.25,"such hot-air thoughts deserved a second, bigger balloon and i poured it."
1739,1.3,"head propped in my right palm, i approached that ill-lit precinct where self-pity becomes a mellow pleasure."
1740,0.7000000000000002,"i was a special case of the general banishment, though it was not adam"
1741,0.0,i was thinking of.
1742,0.0,he was not cleverer than me.
1743,0.0,not yet.
1744,-1.5,"no, my exile was for one night only and it gave a twist of sweet, bearable agony to a hopeless love."
1745,0.25,"my shirt unbuttoned to the waist, all windows open, the urban romance of getting thoughtfully drunk amid the heat and dust and muted din of north clapham, in a world city."
1746,0.19999999999999996,the imbalance of our affair was heroic.
1747,1.0,i imagined an onlooker's approving gaze from a corner of the room.
1748,0.0,that well-formed figure slumped in his beaten-up chair.
1749,0.5,i rather loved myself.
1750,0.0,someone had to.
1751,1.5,"i rewarded myself with thoughts of her, mid-ecstasy, and considered the impersonal quality of her pleasures."
1752,0.5,"i was only good enough for her, as many men might be."
1753,-1.25,"i refused the obvious, that her distance was the whip that drove my longing."
1754,-0.5,but here was something strange.
1755,-0.4,"three days before, she had asked a mysterious question."
1756,-0.25,"we were mid-embrace, in the conventional position."
1757,0.0,she drew my face towards hers.
1758,0.0,her look was serious.
1759,0.0,"she whispered, ""tell me something."
1760,0.0,"are you real?"""
1761,0.0,i did not reply.
1762,0.0,she turned her head away so that i saw her in profile as her eyes closed
1763,-0.25,and she lost herself once more in a maze of private pleasure.
1764,0.0,"later that night, i asked her about it."
1765,0.0,was i real?
1766,1.9,"meaning did i really love her, or was i honest, or did i fit her needs so exactly that she might have dreamed me up?"
1767,0.0,i crossed the kitchen to pour the last of the wine.
1768,0.85,the broken fridge door handle needed a sharp sideways pull to engage its lock.
1769,-1.5,"as my hand closed round the cold neck of the bottle, i heard a sound, a creak above my head."
1770,0.25,i had lived long enough beneath miranda's feet to know her steps and their precise direction.
1771,0.0,she had moved across her bedroom and was hesitating in the threshold of her kitchen.
1772,-0.25,i heard the murmur of her voice.
1773,0.0,no reply.
1774,0.0,she took another two steps into the room.
1775,-0.5,the next would bring her onto a floorboard that under pressure made a truncated quacking sound.
1776,0.0,"as i waited to hear it, adam spoke."
1777,0.0,he pushed his chair back as he stood.
1778,0.0,if he was to take another step he would need to untether himself.
1779,-0.75,this he must have achieved because it was his tread that landed on the noisy floorboard.
1780,0.0,"that meant they were standing less than a metre apart, but there was no sound until a minute had passed, and now it was footsteps, two sets, moving back towards the bedroom."
1781,-0.75,i left the fridge door open because the sound of it closing would betray me.
1782,0.4,no choice but to shadow them into my bedroom.
1783,0.0,so i went and stood by my desk and listened.
1784,0.55,"i reckoned i was right under her bed when i heard the murmur of her voice, a command."
1785,0.0,"she must have wanted air in the room, for adam's steps tracked across the room towards the victorian bay."
1786,0.0,only one of its three windows opened.
1787,0.0,even that one was hard to shift on a warm or rainy day.
1788,-1.5,"the old wooden frames shrank or expanded, and something was wrong with the counterweight and hardened rope."
1789,0.0,"our age could devise a passable replica of a human mind, but there was no one in our neighbourhood to fix a sash window, though a few had tried."
1790,0.0,"and how was my mind as i stood directly below, in an identical bay, reproduced by the thousands in late-victorian industrial-scale developments?"
1791,0.15000000000000002,they had spilled across the five-acre fields of hedgerow and boundary oaks that adorned the southern limits of london.
1792,0.0,"not good--my mind, that is."
1793,0.0,"embodied, it told all."
1794,1.25,"shivering, moist, especially on the palms, raised pulse, in a state of elated anticipation."
1795,-1.25,"fear, self-doubt, fury."
1796,1.1,"in my bay, old fitted carpet, stained and worn since the mid-fifties, extended right to the skirting boards."
1797,-0.5,"in miranda's, the carpet gave way to bare boards that, two world wars back, must have been polished to a nut-brown gleam."
1798,-0.4,"some poor girl in white apron and mob cap, on all fours, waxed cloth in hand, never could have dreamed of the kind of being who would one day stand in the place where she crouched."
1799,0.9,"i heard him plant his feet on the old wood, i imagined him stooping to grip the window by the metal fixtures on its lower frame and heave upwards with the strength of four young men."
1800,-2.3499999999999996,there was a silence of straining resistance before the entire window shot upwards and hit the top casing with a rifle crack and a shattering of glass.
1801,1.0,my snort of delight could have given me away.
1802,-1.15,no shortage now of marginally cooler air filling the room.
