1,1.3,"but remember, please, the law by which we live, we are not built to comprehend a lie ..."
2,0.0,"kipling, ""the secret of the machines"""
3,1.25,"it was religious yearning granted hope, it was the holy grail of science."
4,-1.0,"our ambitions ran high and low--for a creation myth made real, for a monstrous act of self-love."
5,-0.25,"as soon as it was feasible, we had no choice but to follow our desires and hang the consequences."
6,-0.6000000000000001,"in loftiest terms, we aimed to escape our mortality, confront or even replace the godhead with a perfect self."
7,3.0,"more practically, we intended to devise an improved, more modern version of ourselves and exult in the joy of invention, the thrill of mastery."
8,0.9500000000000001,"in the autumn of the twentieth century, it came about at last, the first step towards the fulfilment of an ancient dream, the beginning of the long lesson we would teach ourselves that however complicated we were, however faulty and difficult to describe in even our simplest actions and modes of being, we could be imitated and bettered."
9,1.15,"and i was there as a young man, an early and eager adopter in that chilly dawn."
10,-1.5,"but artificial humans were a cliche long before they arrived, so when they did, they seemed to some a disappointment."
11,-0.09999999999999995,"the imagination, fleeter than history, than technological advance, had already rehearsed this future in books, then films and tv dramas, as if human actors, walking with a certain glazed look, phony head movements, some stiffness in the lower back, could prepare us for life with our cousins from the future."
12,0.5,"i was among the optimists, blessed by unexpected funds following my mother's death and the sale of the family home, which turned out to be on a valuable development site."
13,0.5,"the first truly viable manufactured human with plausible intelligence and looks, believable motion and shifts of expression, went on sale the week before the falklands task force set off on its hopeless mission."
14,0.0,"adam cost ps86,000."
15,-0.75,i brought him home in a hired van to my unpleasant flat in north clapham.
16,2.05,"i would made a reckless decision, but i was encouraged by reports that sir alan turing, war hero and presiding genius of the digital age, had taken delivery of the same model."
17,0.4,fie probably wanted to have his lab take it apart to examine its workings fully.
18,0.0,"twelve of this first edition were called adam, thirteen were called eve."
19,0.5,"corny, everyone agreed, but commercial."
20,-0.8,"notions of biological race being scientifically discredited, the twenty-five were designed to cover a range of ethnicities."
21,-2.0,"there were rumours, then complaints, that the arab could not be told apart from the jew."
22,1.3,random programming as well as life experience would grant to all complete latitude in sexual preference.
23,0.0,"by the end of the first week, all the eves sold out."
24,-0.5,"at a careless glance, i might have taken my adam for a turk or a greek."
25,0.25,"he weighed 170 pounds, so i had to ask my upstairs neighbour, miranda, to help me carry him in from the street on the disposable stretcher that came with the purchase."
26,0.0,"while his batteries began to charge, i made us coffee, then scrolled through the 470-page online handbook."
27,1.0,its language was mostly clear and precise.
28,0.0,but adam was created across different agencies and in places the instructions had the charm of a nonsense poem.
29,1.25,"unreveal upside of b347k vest to gain carefree emoticon with motherboard output to attenuate mood-swing penumbra."""
30,-0.25,"at last, with cardboard and polystyrene wrapping strewn around his ankles, he sat naked at my tiny dining table, eyes closed, a black power line trailing from the entry point in his umbilicus to a thirteen-amp socket in the wall."
31,-0.25,it would take sixteen hours to fire him up.
32,0.0,then sessions of download updates and personal preferences.
33,0.0,"i wanted him now, and so did miranda."
34,2.4,"like eager young parents, we were avid for his first words."
35,-1.0,there was no loudspeaker cheaply buried in his chest.
36,1.15,"we knew from the excited publicity that he formed sounds with breath, tongue, teeth and palate."
37,1.1,already his lifelike skin was warm to the touch and as smooth as a child's.
38,-1.0,miranda claimed to see his eyelashes flicker.
39,0.0,"i was certain she was seeing vibrations from the tube trains rolling a hundred feet below us, but i said nothing."
40,0.1,adam was not a sex toy.
41,0.0,"however, he was capable of sex and possessed functional mucous membranes, in the maintenance of which he consumed half a litre of water each day."
42,1.2999999999999998,"while he sat at the table, i observed that he was uncircumcised, fairly well endowed, with copious dark pubic hair."
43,1.5499999999999998,this highly advanced model of artificial human was likely to reflect the appetites of its young creators of code.
44,0.75,"the adams and eves, it was thought, would be lively."
45,2.9000000000000004,"he was advertised as a companion, an intellectual sparring partner, friend and factotum who could wash dishes, make beds and ""think."
46,0.0,"he could not drive as yet and was not allowed to swim or shower or go out in the rain without an umbrella, or operate a chainsaw unsupervised."
47,1.4,"as for range, thanks to breakthroughs in electrical storage, he could run seventeen kilometres in two hours without a charge or, its energy equivalent, converse non-stop for twelve days."
48,0.25,he had a working life of twenty years.
49,0.45000000000000007,"he was compactly built, square-shouldered, dark-skinned, with thick black hair swept back; narrow in the face, with a hint of hooked nose suggestive of fierce intelligence, pensively hooded eyes, tight lips that, even as we watched, were draining of their deathly yellowish-white tint and acquiring rich human colour, perhaps even relaxing a little at the corners."
50,0.0,"miranda said he resembled ""a docker from the bosphorus."""
51,0.5,"before us sat the ultimate plaything, the dream of ages, the triumph of humanism--or its angel of death."
52,0.25,"exciting beyond measure, but frustrating too."
53,0.0,sixteen hours was a long time to be waiting and watching.
54,0.8,"i thought that for the sum i would handed over after lunch, adam should have been charged up and ready to go."
55,-0.25,it was a wintry late afternoon.
56,0.0,i made toast and we drank more coffee.
57,2.0,"miranda, a doctoral scholar of social history, said she wished the teenage mary shelley was here beside us, observing closely, not a monster like frankenstein's, but this handsome dark-skinned young man coming to life."
58,-0.3999999999999999,i said that what both creatures shared was a hunger for the animating force of electricity.
59,0.25,"she spoke as though she was referring only to herself and me, rather than all of electrochemically charged humanity."
60,0.75,"she was twenty-two, mature for her years and"
61,0.25,ten years younger than me.
62,0.0,"from a long perspective, there was not much between us."
63,0.9,we were gloriously young.
64,0.0,but i considered myself at a different stage of life.
65,0.0,my formal education was far behind me.
66,-0.7,i would suffered a series of professional and financial and personal failures.
67,1.15,"i regarded myself as too hard-bitten, too cynical for a lovely young woman like miranda."
68,1.7000000000000002,"and though she was beautiful, with pale brown hair and a long thin face, and eyes that often appeared narrowed by suppressed mirth, and though in certain moods i looked at her in wonder, i would decided early on to confine her in the role of kind, neighbourly friend."
69,1.6,we shared an entrance hall and her tiny apartment was right over mine.
70,0.65,we saw each other for a coffee now and then to talk about relationships and politics and all the rest.
71,0.85,with pitch-perfect neutrality she gave the impression of being at ease with the possibilities.
72,2.6,"to her, it seemed, an afternoon of intimate pleasure with me would have weighed equally with a chaste and companionable chat."
73,0.5,she was relaxed in my company
74,0.15000000000000002,and i preferred to think that sex would ruin everything.
75,0.75,we remained good chums.
76,0.30000000000000004,but there was something alluringly secretive or restrained about her.
77,1.35,"perhaps, without knowing it, i had been in love with her for months."
78,0.6,without knowing it?
79,-0.5,what a flimsy formulation that was!
80,0.0,"reluctantly, we agreed to turn our backs on adam and on each other for a while."
81,0.0,"miranda had a seminar to attend north of the river, i had emails to write."
82,-0.6,"by the early seventies, digital communication had discarded its air of convenience and become a daily chore."
83,-0.75,likewise the 250 mph trains--crowded and dirty.
84,0.0,"speech-recognition software, a fifties miracle, had long turned to drudge, with entire populations sacrificing hours each day to lonely soliloquising."
85,0.0,brain--
86,2.65,"machine interfacing, wild fruit of sixties optimism, could barely arouse the interest of a child."
87,0.75,"what people queued the entire weekend for became, six months later, as interesting as the socks on their feet."
88,-0.25,"what happened to the cognition-enhancing helmets, the speaking fridges with a sense of smell?"
89,-0.4,"gone the way of the mouse pad, the filofax, the electric carving knife, the fondue set."
90,0.0,the future kept arriving.
91,1.05,"our bright new toys began to rust before we could get them home, and life went on much as before."
92,-0.75,would adam become a bore?
93,-0.7999999999999999,"it is not easy, to dictate while trying to ward off a bout of buyer's remorse."
94,0.9,"surely other people, other minds, must continue to fascinate us."
95,0.5,"as artificial people became more like us, then became us, then became more than us, we could never tire of them."
96,0.35,they were bound to surprise us.
97,-0.75,they might fail us in ways that were beyond our imagining.
98,-1.25,"tragedy was a possibility, but not boredom."
99,0.7,what was tedious was the prospect of the user's guide.
100,0.0,instructions.
101,0.25,my prejudice was that any machine that could not tell you by its very functioning how it should be used was not worth its keep.
102,0.0,"on an old-fashioned impulse, i was printing out the manual, then looking for a folder."
103,0.0,"all the while, i continued to dictate emails."
104,0.0,"i could not think of myself as adam's ""user."
105,-0.5,but the manual in my hands had fallen open at chapter fourteen.
106,0.0,here the english was plain: preferences; personality parameters.
107,0.0,then a set of headings--agreeableness.
108,0.0,extraversion.
109,0.5,openness to experience.
110,0.0,conscientiousness.
111,0.5,emotional stability.
112,0.8,the list was familiar to me.
113,0.4,the five factor model.
114,0.8,"educated as i was in the humanities, i was suspicious of such reductive categories, though i knew from a friend in psychology that each item had many subgroups."
115,0.0,glancing at the next page i saw that i was supposed to select various settings on a scale of one to ten.
116,0.8,i would been expecting a friend.
117,0.30000000000000004,"i was ready to treat adam as a guest in my home, as an unknown i would come to know."
118,0.0,i would thought he would arrive optimally adjusted.
119,0.15000000000000002,factory settings--a contemporary synonym for fate.
120,0.0,"my friends, family and acquaintances all had appeared in my life with fixed settings, with unalterable histories of genes and environment."
121,1.35,i wanted my expensive new friend to do the same.
122,-0.25,why leave it to me?
123,0.0,but of course i knew the answer.
124,0.0,not many of us are optimally adjusted.
125,1.0,gentle jesus?
126,0.6,humble darwin?
127,0.0,"one every 1,800 years."
128,-0.25,"even if it knew the best, the least harmful parameters of personality, which it could not, a worldwide corporation with a precious reputation could not risk a mishap."
129,0.0,caveat emptor.
130,1.65,god had once delivered a fully formed companion for the benefit of the original adam.
131,0.0,i had to devise one for myself.
132,-0.75,here was extraversion and a graded set of childish statements.
133,1.75,he loves to be the life and soul of the party and he knows how to entertain people and lead them.
134,-0.65,"and at the bottom, he feels uncomfortable around other people and he prefers his own company."
135,2.0,"here in the middle was, he likes a good party but he is always happy to come home."
136,0.0,this was me.
137,0.0,but should i be replicating myself?
138,0.0,if i was to choose from the middle of each scale i might devise the soul of blandness.
139,0.6,extraversion appeared to include its antonym.
140,-0.10000000000000009,"there was a long adjectival list with boxes to tick: outgoing, shy, excitable, talkative, withdrawn, boastful, modest, bold, energetic, moody."
141,0.0,"i wanted none of them, not for him, not for myself."
142,-2.1,"apart from my moments of crazed decisions, i passed most of my life, especially when alone, in a state of mood neutrality, with my personality, whatever that was, in suspension."
143,-0.55,"not bold, not withdrawn."
144,1.05,"simply here, neither content nor morose, but carrying out tasks, thinking about dinner or sex, staring at the screen, taking a shower."
145,-0.75,"intermittent regrets about the past, occasional forebodings about the future, barely aware of the present, except in the obvious sensory realm."
146,-0.5,"psychology, once so interested in the trillion ways the mind goes awry, was now drawn to what it considered the common emotions, from grief to joy."
147,-2.9499999999999997,"but it had overlooked a vast domain of everyday existence: absent illness, famine, war or other stresses, a lot of life is lived in the neutral zone, a familiar garden, but a grey one, unremarkable, immediately forgotten, hard to describe."
148,0.0,"at the time, i was not to know that these graded options would have little effect on adam."
149,0.8,"the real determinant was what was known as ""machine learning."""
150,0.6,"the user's handbook merely granted an illusion of influence and control, the kind of illusion parents have in relation to their children's personalities."
151,2.1,it was a way of binding me to my purchase and providing legal protection for the manufacturer.
152,0.25,"allow yourself several weeks, if necessary."""
153,0.0,i let half an hour pass before i checked on him again.
154,0.0,no change.
155,0.6,"still at the table, arms pushed out straight before him, eyes closed."
156,1.05,"but i thought his hair, deepest black, was bulked out a little and had acquired a certain shine, as though he would just had a shower."
157,1.85,"stepping closer, i saw to my delight that though he was not breathing, there was, by his left breast, a regular pulse, steady and calm, about one a second by my inexperienced guess."
158,1.0,how reassuring.
159,0.0,"he had no blood to pump around, but this simulation had an effect."
160,-0.5,my doubts faded just a little.
161,-0.25,"i felt protective towards adam, even as i knew how absurd it was."
162,0.75,"i stretched out my hand and laid it over his heart and felt against my palm its calm, iambic tread."
163,-0.5,i sensed i was violating his private space.
164,1.2000000000000002,these vital signs were easy to believe in.
165,0.6,"the warmth of his skin, the firmness and yield of the muscle below it"
166,-1.5,"it was eerie, to be standing by this naked man, struggling between what i knew and what i felt."
167,-0.6,"i walked behind him, partly to be out of range of eyes that could open at any moment and find me looming over him."
168,0.6,he was muscular around his neck and spine.
169,-0.6,dark hair grew along the line of his shoulders.
170,0.6,his buttocks displayed muscular concavities.
171,-0.25,"below them, an athlete's knotted calves."
172,0.8,i had not wanted a superman.
173,-1.25,i regretted once more that i would been too late for an eve.
174,0.6,"on my way out of the room i paused to look back and experienced one of those moments that can derange the emotional life: a startling realisation of the obvious, an absurd leap of understanding into what one already knows."
175,0.0,i stood with one hand resting on the doorknob.
176,0.4,"it must have been adam's nakedness and physical presence that prompted the insight, but i was not looking at him."
177,0.0,it was the butter dish.
178,0.0,"also, two plates and cups, two knives and two spoons scattered across the table."
179,0.0,the remains of my long afternoon with miranda.
180,0.0,"two wooden chairs were pushed back from the table, turned companionably towards each other."
181,0.0,we had become closer this past month.
182,0.0,we talked easily.
183,0.25,i saw how precious she was to me and how carelessly i could lose her.
184,0.0,i should have said something by now.
185,0.5,i would taken her for granted.
186,-0.35,"some unfortunate event, some person, a fellow student, could get between us."
187,-0.5,"her face, her voice, her manner, both reticent and clear-headed, were sharply present."
188,-0.75,"the feel of her hand in mine, that lost, preoccupied manner she had."
189,0.30000000000000004,"yes, we had become very close and i would failed to notice it was happening."
190,-1.0,i was an idiot.
191,0.0,i had to tell her.
192,0.0,"i went back into my office, which doubled as my bedroom."
193,-0.25,between the desk and the bed there was enough space in which to walk up and down.
194,0.0,that she knew nothing about my feelings
195,-0.75,was now an anxious matter.
196,-1.25,"describing them would be embarrassing, perilous."
197,1.3,"she was a neighbour, a friend, a kind of sister."
198,0.0,i would be addressing a person i did not yet know.
199,-0.25,"she would be obliged to step out from behind a screen, or remove a mask and speak to me in terms i had never heard from her."
200,-0.5,i am so sorry...
201,0.5,i like you very much
202,0.0,"but, you see ..."
203,-0.75,or she would be horrified.
204,-0.5,"or, just possibly, overjoyed to hear the one thing she had longed for, or to say herself but dreaded rejection."
205,0.75,"by chance, we were currently both free."
206,0.0,"she must have thought about it, about us."
207,0.0,it was not an impossible fantasy.
208,0.0,i would have to tell her face to face.
209,-0.75,unbearable.
210,-0.5,unavoidable.
211,0.0,"and so it went on, in tightening cycles."
212,-0.5,"restless, i went back next door."
213,0.4,"i saw no change in adam as i brushed past to get to the fridge, where there was a half-full bottle of white bordeaux."
214,0.0,i sat facing him and raised my glass.
215,0.75,to love.
216,0.8,"this time, i felt less tenderness."
217,0.25,"i saw adam for what it was, an inanimate confection whose heartbeat was a regular electrical discharge, whose skin warmth was mere chemistry."
218,0.5,"when activated, some kind of microscopic balance-wheel device would prise open his eyes."
219,-0.75,"he would seem to see me, but he would be blind."
220,-0.75,not even blind.
221,-0.25,"when it kicked in, another system would give a semblance of breath, but not of life."
222,0.75,a man newly in love knows what life is.
223,0.6,"with the inheritance, i could have bought a place somewhere north of the river, notting hill, or chelsea."
224,0.6,she might even have joined me.
225,0.0,she would have had space for all the books that were boxed up in her father's garage in salisbury.
226,1.2,"i saw a future without adam, the future that was mine until yesterday: an urban garden, high ceilings with plaster mouldings, stainless-steel kitchen, old friends to dinner."
227,0.0,books everywhere.
228,0.0,what to do?
229,-0.75,"i could take him, or it, back, or sell it online and take a small loss."
230,-0.75,i gave it a hostile look.
231,-0.25,"the hands were palms down on the table, the hawkish face remained angled towards the hands."
232,0.15000000000000005,my foolish infatuation with technology!
233,0.0,another fondue set.
234,-1.7000000000000002,best to get away from the table before i impoverished myself with a single swipe of my father's old claw hammer.
235,-0.65,"i drank no more than half a glass, then i returned to the bedroom to distract myself with the asian currency markets."
236,0.0,all the while i listened out for footsteps in the flat above me.
237,-1.1,"late into the evening, i watched tv to catch up on the task force that would soon set off across 8,000 miles of ocean to recapture what we then called the falkland islands."
238,-0.35,"at thirty-two, i was completely broke."
239,-0.8,wasting my mother's inheritance on a gimmick was only one part of my problem--but typical of it.
240,1.25,"whenever money came my way, i caused it to disappear, made a magic bonfire of it, stuffed it into a top hat and pulled out a turkey."
241,0.0,"often, though not in this recent case, my intention was to conjure a far larger sum with minimal effort."
242,0.0,"i was a mug for schemes, semilegal ruses, cunning shortcuts."
243,1.5,i was for grand and brilliant gestures.
244,0.0,others made them and flourished.
245,0.55,"they borrowed money, put it to interesting use and remained enriched even as they settled their debts."
246,0.6,"or they had jobs, professions, as i once had, and enriched themselves more modestly, at a steady rate."
247,-0.5,"i meanwhile leveraged or, rather, shorted myself into genteel ruin, into two damp ground-floor rooms in the dull no-man'sland of edwardian terraced streets between stockwell and clapham, south london."
248,0.6,"i grew up in a village near stratford, warwickshire, the only child of a musician father and community-nurse mother."
249,0.6,"compared to miranda's, my childhood was culturally undernourished."
250,0.6,"i here was no time or space for books, or even music."
251,1.0,"i took a precocious interest in electronics but ended up with an anthropology degree from an unregarded college in the south midlands; i did a conversion course to law and, once qualified, specialised in tax."
252,-0.44999999999999996,"a week after my twenty-ninth birthday i was struck off, and came close to a short spell in prison."
253,1.2,my hundred hours of community service convinced me that i should never have a regular job again.
254,0.2500000000000001,i made some money out of a book i wrote at high speed on artificial intelligence: lost to a life-extension-pill scheme.
255,-0.1,i made a reasonable sum on a property deal: lost to a car-rental scheme.
256,0.25,i was left some funds by a favourite uncle who had proswhispered by way of a heat-pump patent:
257,-0.85,lost to a medical-insurance scheme.
258,0.6,"at thirty-two, i was surviving by playing the stock and currency markets online."
259,0.4,"a scheme, just like the rest."
260,-1.25,"for seven hours a day i bowed before my keyboard, buying, selling, hesitating, punching the air one moment, cursing the next, at least at the beginning."
261,0.0,"i read market reports, but i believed i was dealing in a random system and mostly relied on guesses."
262,0.8,"sometimes i leaped ahead, sometimes i plunged, but on average through the year i made about as much as the postman."
263,1.35,"i paid my rent, which was low in those days, ate and dressed well enough and thought i was beginning to stabilise, learning to know myself."
264,1.65,i was determined that my thirties would be a superior performance to my twenties.
265,1.8,but my parents' pleasant family home was sold just as the first convincing artificial person came on the market.
266,0.5,"robots, androids, replicates were my passion, even more so after my research for the book."
267,0.09999999999999998,"prices were bound to fall, but i had to have one straight away, an eve by preference, but an adam would do."
268,0.0,it could have turned out differently.
269,0.55,"my previous girlfriend, claire, was a sensible person who trained to be a dental nurse."
270,0.65,she worked in a harley street practice and she would have talked me out of adam.
271,0.0,"she was a woman of the world, of this one."
272,0.0,she knew how to arrange a life.
273,0.0,and not only her own.
274,-1.75,but i offended her with an act of undeniable disloyalty.
275,0.25,"she disowned me in a scene of regal fury, at the end of which she threw my clothes out into the street."
276,0.0,lime grove.
277,-0.25,she never spoke to me again and belonged at the top of my list of errors and failures.
278,0.8,she could have saved me from myself.
279,0.0,but.
280,1.1,"in the interests of balance, let that unsaved self speak up."
281,0.6,i did not buy adam to make money.
282,-0.6,on the contrary.
283,1.0,my motives were pure.
284,2.55,"i handed over a fortune in the name of curiosity, that steadfast engine of science, of intellectual life, of life itself."
285,-0.25,i his was no passing fad.
286,0.8,"there was a history, an account, a time-deposit, and i had a right to draw on it."
287,0.35,electronics and anthropology--distant cousins whom late modernity has drawn together and bound in marriage.
288,0.6,the child of that coupling was adam.
289,0.0,"so, i appear before you, witness for the defence, after school, 5 p.m., typical specimen for my time--short trousers, scabby knees, freckles, short back and sides, eleven years old."
290,0.0,"i m first in line, waiting for the lab to open and for ""wiring club to begin."
291,1.0,"presiding is mr. cox, a gentle giant with carroty hair who teaches physics."
292,0.1,my project is to build a radio.
293,1.0,"its an act of faith, an extended prayer that has taken many weeks."
294,0.0,"i have a base of hardboard, six inches by nine, easily drilled."
295,0.0,colours are everything.
