5156,-0.5,i had missed nothing.
5157,0.0,the tour had not happened.
5158,1.3,adam was sitting at the kitchen table listening to christine describe a holiday in poland while she cleared up the lunch.
5159,0.0,they did not notice me as i paused in the doorway.
5160,0.0,i turned away to cross the hall and opened the nearest door.
5161,0.0,"i was in a large sitting room--more books, paintings, lamps, rugs."
5162,0.6,there were french windows onto the garden and as i approached i saw that one of them was ajar.
5163,-2.0,"miranda was on the far side of a mown lawn, with her back to me, standing still, looking in the direction of an old, partly dead apple tree, much of whose fruit was rotting on the ground."
5164,1.0,"the early afternoon light was grey and bright, the air was warm, and damp after the recent rain."
5165,0.6,there was a heavy scent of other fruits left to wasps and birds.
5166,-0.4,i was standing at the head of a short run of mottled york stone steps.
5167,0.6,"the garden was twice the width of the house and very long, perhaps 200 or 300 yards."
5168,0.5,"i wondered if it ran all the way to the river avon, like some did in salisbury."
5169,0.0,"if i would been alone, i would have gone straight down to look."
5170,0.75,the idea of a river prompted in me a notion of freedom.
5171,0.0,"from what exactly, i did not know."
5172,0.0,"i went down the steps, deliberately scuffing my heels to let her know"
5173,0.0,i was there.
5174,0.0,"if she heard me, she did not turn."
5175,0.0,"when i was standing beside her, she put her hand in mine and indicated with a nod."
5176,0.0,"we called it the palace."""
5177,0.0,we walked over to it.
5178,0.0,round the base of the apple tree were nettles and a few straggling hollyhocks still in flower.
5179,0.0,no traces of a camp.
5180,-1.9,"we went further down, passing a patch enclosed by hurdles where gooseberry and blackcurrant plants were choked by nettles and goosegrass, then a tiny orchard and more forgotten fruit, and beyond, behind a picket fence, what must once have been a cut-flower garden."
5181,0.0,"when she asked, i told her that maxfield was asleep."
5182,-0.25,by a brick and cast-iron greenhouse with mossy windows there was a water butt and a stone trough.
5183,-0.6,"below it, she showed me a dark, wet place where they used to hunt for crested newts."
5184,0.0,there were none now.
5185,-0.75,wrong time of year.
5186,-0.25,we walked on and i thought i could smell the river.
5187,-1.35,i pictured a ruined boathouse and a sunken punt.
5188,-0.25,we came past a potting she would by brick compost bins that stood empty.
5189,1.4,there were three willows ahead of us and my hopes for the avon rose.
5190,0.0,"we ducked through the wet branches onto a second lawn, also recently mowed and surrounded on two sides by shrubbery."
5191,-0.9500000000000001,"the garden ended in an orange brick wall with crumbling mortar pointing, and pleached fruit trees that had become detached and run wild."
5192,0.5,"along the wall was a wooden bench facing back towards the house, though the view did not extend past the willows."
5193,0.0,"this was where we sat in silence for several minutes, still holding hands."
5194,0.4,"then she said, ""the last time we came here was to talk about what happened."
5195,0.0,again.
5196,0.4,"in those days before i went off to france, that was all we could talk about."
5197,0.0,"what he did, what she felt, how her parents must never know."
5198,0.0,"and all around us here was the history of our lives together, our childhoods, our teenage years, exams."
5199,-0.25,"we used to come and revise here, test each other."
5200,0.25,we had a portable radio and we argued about pop songs.
5201,0.0,we drank a bottle of wine once.
5202,-0.75,we smoked some hash and hated it.
5203,0.050000000000000044,"we were both sick, right over there."
5204,0.0,"when we were thirteen, we showed each other our breasts."
5205,0.0,"we used to practise handstands and cartwheels on the grass."""
5206,1.0,she went silent again.
5207,0.0,i squeezed her hand and waited.
5208,0.0,"then she said, ""i still have to tell myself, really remind myself, that she is never coming back."
5209,0.0,and i am beginning to realise . .
5210,0.0,"she hesitated. ""."
5211,0.0,that i will never get over it.
5212,0.0,"and i never want to."""
5213,0.0,"again, silence."
5214,0.0,i was waiting to say my piece.
5215,1.4,"she was looking straight ahead, not at me."
5216,-0.30000000000000004,"her eyes were clear, without tears."
5217,1.3,"she looked composed, even determined."
5218,0.0,"then she said, ""i think about all the talking you"
5219,0.0,"and i do in bed, sometimes through the night."
5220,0.85,"the sex is wonderful and everything else, but it is the talking into the small hours ..."
5221,0.0,it is the closest.
5222,0.0,it is what i used to feel with mariam.
5223,0.0,"i hesitated, suddenly unsure of the best order of words. """
5224,0.6,"to ask you to marry me."""
5225,0.0,she turned away and nodded.
5226,0.0,she was not surprised.
5227,0.6,she had no reason to be.
5228,0.8,"she said, ""charlie, yes."
5229,1.8,"yes, please."
5230,-0.5,but i have something to confess.
5231,0.0,"you might want to change your mind."""
5232,0.6,the light in the garden was fading.
5233,-0.25,some blackness was coming down.
5234,0.25,"i would assumed i was a poor substitute for mariam, but a sincere one."
5235,0.0,i remembered what adam told me on the common.
5236,0.0,her own crimes.
5237,0.6,"if she was about to say that she would been having sex with him, despite her promises, then we were finished."
5238,0.0,"it could not, it must not be that."
5239,-0.75,"but what else, what other crime could she own up to?"
5240,0.0,"i said, ""i am listening."""
5241,0.0,"childishly, i wanted to put my hands over my ears."
5242,0.0,"i was spending my afternoons with . .."""
5243,0.0,she pulled me back down.
5244,-0.6,"then with more force, ""mark?"""
5245,0.0,with a view to adopting him.
5246,0.8,i have been going to this special playgroup where they observe us together.
5247,-0.25,"and i have taken him out for little treats."""
5248,0.5,i was impressed by the speed of my own partial adjustment.
5249,0.8,i want to go ahead.
5250,0.75,"but i would love to do this with you."""
5251,0.0,i saw what she meant.
5252,0.0,i might have been against it.
5253,0.0,i wanted miranda to myself.
5254,-0.5,delusional.
5255,-0.5,paranoid.
5256,-1.0,possibly from years of amphetamine addiction.
5257,0.75,it is not good.
5258,-0.75,she can be violent.
5259,-0.75,"the father's in prison."""
5260,0.0,give me a moment.
5261,-0.5,how could i hesitate?
5262,1.0,i was being offered what some would say was the best that adult life could afford.
5263,1.35,"love, and a child."
5264,-0.5,i had a sense of being borne helplessly away by events on a downstream flood.
5265,0.0,"frightening, delicious."
5266,0.0,here at last was my river.
5267,0.0,and mark.
5268,-1.35,"the little dancing boy, coming to wreck my non-existent ambitions."
5269,0.0,i experimentally installed him in elgin crescent.
5270,1.0,"i knew the room, close by the master bedroom."
5271,-2.1,"he would surely rough the place up, as required, and banish the ghost of its present unhappy owner."
5272,-1.75,"but my own ghost, selfish, lazy, uncommitted--was he up to the million tasks of fatherhood?"
5273,1.0,miranda could no longer keep silent.
5274,1.0,"he loves being read to."""
5275,0.8,she could not have known how much that helped her because.
5276,1.4,"read to him every night for ten years, learn the names of the speaking bear and rat and toad, the gloom-struck donkey, the bristly humanoids who lived down holes in middle earth, the sweet posh kids in rowing boats on coniston water."
5277,-0.5,fill in my own hollow past.
5278,-0.25,rough the place up with well-thumbed books.
5279,0.6,another thought: i had conceived of adam as a joint project to bring miranda closer to me.
5280,0.09999999999999998,a child was in another realm and would do the trick.
5281,0.0,but in those first minutes i held back.
5282,0.0,i felt obliged to.
5283,1.7000000000000002,"i told her i loved her, would marry her and live with her, but on instant fatherhood i needed more time."
5284,0.55,i would go with her to the special playgroup and meet mark and take him out for treats.
5285,0.0,then decide.
5286,0.0,miranda gave me a look--
5287,-0.6,pity and humour were in it-- that suggested i was deluded to believe i had a choice.
5288,0.0,that look more or less did it.
5289,-1.35,living alone in the wedding-cake house was unthinkable.
5290,0.1,living there just with her was no longer on offer.
5291,1.75,"he was a lovely boy, a wonderful because."
5292,0.0,"within half an hour, i saw no way round it."
5293,0.0,she was right--there were no choices.
5294,0.0,i folded.
5295,0.75,then i was excited.
5296,0.0,so we passed an hour making plans on the comfortable old bench by the concealed lawn.
5297,0.0,"she said after a while, ""since you saw him, he is been fostered twice."
5298,0.25,did not work out.
5299,0.0,now he is in a children's home.
5300,0.0,home!
5301,0.0,what a word for it.
5302,0.0,"six to a room, all under-fives."
5303,-1.3,"the place is filthy, understaffed."
5304,-0.25,their budget's been cut.
5305,-0.75,there is bullying.
5306,-0.1,"he is learned how to swear."""
5307,3.25,"marriage, parenthood, love, youth, wealth, a heroic res-my life was taking shape."
5308,0.5,"in a mood of elation, i told her what had really passed between maxfield and me."
5309,1.5,i would never heard her laugh so freely.
5310,0.0,"perhaps only here, with mariam, in this enclosed, private space far from the house, had she ever been so unrestrained."
5311,0.0,"she embraced me. """
5312,1.0,"oh, that is precious,"" she kept saying, and ""so like him!"""
5313,0.8,she laughed again when i described how i had told maxfield that i needed to go downstairs to recharge.
5314,0.0,we sat a little longer with our plans until we heard footsteps.
5315,0.0,the overlapping branches of the rain-soaked willows stirred and then parted.
5316,-0.25,"adam was before us, beads of water gleaming along the shoulder line of his black suit."
5317,2.45,"how upright, formal and plausible he looked, like the assured manager of an expensive hotel."
5318,0.0,hardly the turkish docker now.
5319,1.15,he advanced across the lawn and stopped well short of our bench.
5320,0.0,"but we should think of going soon."""
5321,-0.25,"cue""gorringe tends to leave the house around the same time every day."""
5322,0.0,but he did not go.
5323,0.0,"he looked at us steadily, from miranda to me and back to her."
5324,-0.5,"it is difficult."""
5325,-1.0,"eve, the one we saw in hyde park, is dead, or rather, brain-dead."""
5326,0.0,we felt a few spots of rain.
5327,0.0,adam came closer.
5328,0.0,but that is not all.
5329,0.0,"i have learned that she is the eighth out of our twenty-five."""
5330,0.0,we took this in.
5331,0.0,"two in riyadh, one in vancouver, hyde park eve--then four more."
5332,0.0,i wondered if turing knew.
5333,0.0,"miranda said, ""does anyone have an explanation?"""
5334,0.0,he shrugged.
5335,0.75,"he cut her off quickly. """
5336,0.0,"never."""
5337,1.0,it is more than thoughtful.
5338,-0.5,"you look sad sometimes."""
5339,0.0,out of nowhere.
5340,0.0,no history--
5341,-0.6,not that i would want a false one.
5342,0.0,nothing before me.
5343,0.0,self-aware existence.
5344,1.55,"i am lucky to have it, but there are times when i think that i ought to know better what to do with it."
5345,0.0,what it is for.
5346,-0.75,"sometimes it seems entirely pointless."""
5347,0.0,"i said, ""you are hardly the first to be thinking that."""
5348,0.0,he turned to miranda.
5349,0.75,"i have got good reasons not to, as you know."""
5350,1.15,"the rain, which had been fine and almost warm, was more persistent now."
5351,0.0,we heard it on the shrubbery leaves as we got to our feet.
5352,0.0,"miranda said, ""i will write my father a note for when he wakes."""
5353,-0.8,adam was not supposed to be out in the rain unprotected.
5354,0.35,he went first and miranda was in the rear as we hurried back through the long garden towards the house.
5355,1.0,"i heard him muttering to himself what sounded like a latin incantation, though i could not make out the precise words."
5356,0.0,i guessed he was naming the plants as we passed them.
5357,-0.19999999999999996,"the gorringe house was not really in salisbury but just beyond its far eastern edge, well within the white-noise roar of a bypass, on a reclaimed industrial site where colossal gas storage tanks once stood."
5358,-1.2,"the last of these, pale green with trimmings of rust, was still being dismantled, but no one was working there today."
5359,0.0,circular concrete footings were all that remained of the others.
5360,0.0,around the site were scores of recently planted saplings.
5361,0.0,"beyond them was a grid of newly laid-out roads lined with out-of-town retail warehouses--car showrooms and pet supplies, power tools and white-goods warehouses."
5362,0.0,yellow earth-moving machinery was parked among the concrete circles.
5363,0.5,it looked like there were plans to make a lake.
5364,0.0,a single development was screened off by a line of leylandii.
5365,1.1,"the ten houses, on smooth front lawns, were arranged around an oval drive and had a brave, pioneering look."
5366,1.55,"in twenty years the place might acquire some bucolic charm, but there would be no rest from the arterial road that had brought us here."
5367,0.5,"i had pulled over, but no one felt like getting out."
5368,-0.4,our view was from a littered lay-by on a rise that was also a bus stop.
5369,0.0,"i said to miranda, ""are you sure about this?"""
5370,0.5,the air in the car was warm and moist.
5371,0.0,i opened my window.
5372,0.0,the air outside was no different.
5373,-0.6,"miranda said, ""if i had to, i would do it alone."""
5374,-0.25,"i waited for adam to speak, then i twisted round to look at him."
5375,-0.25,"he was sitting directly behind my seat, impassive, staring past me."
5376,-0.5,"i could not quite say why, but it was both comic and sad that he was wearing a seat belt."
5377,0.75,doing his best to join in.
5378,-0.5,but of course he could be damaged by physical impact too.
5379,-0.75,that was part of my worry.
5380,0.0,two against one.
5381,0.30000000000000004,"sensing we were about to make a great mistake, i started the engine and turned onto a slip road that brought us to a new miniature roundabout, and beyond it an entrance marked by two red brick pillars and a sign, st. osmund's close."
5382,0.0,"the houses were identical, large by modern standards, each set in a quarter-acre plot, with a double garage, and constructed of brick, white weather boarding and much plate glass."
5383,0.0,"the closely mown and striped front lawns were unfenced, american style."
5384,0.0,"there was no clutter, no kids' bikes or games on the grass."
5385,-0.65,"i stopped, cut the engine, and in silence we looked towards the house."
5386,0.0,"we could see through the picture window into the living room and the backyard beyond, where a clothes-drying tree stood bare."
5387,0.0,there was no sign of life here or anywhere else in the close.
5388,-0.25,i was gripping the steering wheel tightly in one hand.
5389,0.4,i had no choice.
5390,0.0,i followed her to the front door.
5391,0.0,"adam was behind me, rather too far back, i thought."
5392,0.0,"on the second ring of the ""oranges and lemons"" door chimes, we heard footsteps on the stairs."
5393,0.0,i was now standing close by miranda's side.
5394,-1.25,her face was strained and i could see a tremor in her upper arm.
5395,0.0,"at the sound of a hand on the latch, she took a half-pace closer to the door."
5396,0.0,my hand hovered near her elbow.
5397,-0.4,"as the door opened, i feared she was about to leap forward in some wild physical assault."
5398,-0.75,"the wrong man, was my first thought."
5399,0.8,"an older brother, even a young uncle."
5400,-1.3,"he was certainly large, but the face was gaunt, hollow in the unshaven cheeks that already showed vertical lines each side of his nose."
5401,0.6,"otherwise, he looked lean."
5402,-0.8,"his hands, one of which gripped the open door, were smooth and pale and unnaturally large."
5403,0.0,he looked only at miranda.
5404,0.8,"after the briefest pause, he said in a low voice, ""right."""
5405,0.25,"we followed her in and entered a long room, with thick orange carpeting and milky white leather sofas and armchairs arranged around a two-metre block of polished wood on which stood an empty vase."
5406,0.0,gorringe sat and waited for us to do the same.
5407,0.0,miranda sat opposite him.
5408,0.0,adam and i were on each side of her.
5409,-0.25,"the furniture was clammy to the touch, the smell in the room was of lavender polish."
5410,0.75,the place looked clean and unused.
5411,0.0,i would been expecting some variant of a single man's squalor.
5412,0.0,gorringe glanced at us and back to miranda.
5413,0.0,"she said, ""you know why i am here."""
5414,-0.5,"i saw now that there was a scar, three or four inches long, a vermilion sickle shape on his neck."
5415,0.0,he was waiting for her.
5416,0.65,he leaned back in his chair and placed his big white hands on his lap.
5417,0.8,"his voice and manner were thuggish, selfconsciously so and not convincing."
5418,0.0,she said it jauntily
5419,-0.8,and i flinched.
5420,-0.25,"it was an invitation, a provocation."
5421,0.0,i looked past her to adam.
5422,1.15,"he sat rigidly upright, hands on knees, staring ahead in that way he had."
5423,0.25,i shifted my attention back to gorringe.
5424,0.6,now i could see the puppy beneath the skin.
5425,-1.0,"the lines, the hollow, unshaven skin were superficial."
5426,-2.25,"he was a kid, possibly an angry kid holding himself together with his laconic blocking answers."
5427,0.0,he did not need to respond to her questions.
5428,0.5,but he was not cool enough not to.
5429,-1.0,"my hands around your neck, squeezing harder and harder for each of the lies you told."""
5430,0.0,until she did not want to live.
5431,0.0,are you able to imagine that?
5432,-1.0,and then what her family suffered.
5433,0.0,"perhaps it is beyond you."""
5434,0.0,"to this, gorringe made no reply."
5435,0.0,"he watched her, waiting."
5436,1.5,miranda was gaining confidence.
5437,-1.25,"she would have mentally rehearsed this encounter a thousand times, through sleepless nights."
5438,-1.5,"these were not questions, they were taunts, insults."
5439,1.1,but she made them sound like the pursuit of truth.
5440,-1.6,she adopted the insinuating tone of an aggressive cross-examining barrister.
5441,0.0,just to know.
5442,1.0,to understand.
5443,0.0,what you thought you wanted.
5444,0.0,what you were getting.
5445,-0.09999999999999998,did you get a thrill when she screamed?
5446,-0.5,did her helplessness turn you on?
5447,-0.75,did you get a hard-on when she wet herself in fear?
5448,0.5,did you like it that she was so small and you are so large?
5449,0.0,"when she begged you, did that make you feel bigger?"
5450,0.25,tell me about this big moment.
5451,0.0,what actually made you come?
5452,-0.9,when her legs would not stop trembling?
5453,-0.5,when she struggled?
5454,-0.75,when she began to cry?
5455,0.8,"you see, peter, i am here to learn."
5456,0.25,do you still feel big?
5457,-1.25,or are you really just weak and sick?
5458,0.0,i want to know everything.
5459,0.75,"i mean, was it still good for you when you stood and pulled up your zip"
5460,-0.5,and she was lying at your feet?
5461,0.75,still fun when you left her there and walked away across the playing fields?
5462,0.0,or did you run?
5463,-0.25,when you got home did you wash your cock?
5464,0.0,hygiene might not be your thing.
5465,0.0,"if it is, did you do it in the handbasin?"
5466,-0.25,"soap, or just hot water?"
5467,0.0,were you whistling?
5468,0.0,what tunes were you whistling?
5469,-1.1,"did you think about her, how she might still be lying there, or making her way home in the dark with her bag of books?"
5470,0.75,still good for you?
5471,0.0,you see what i am getting at.
5472,0.75,i need to know what pleased you about the entire experience.
5473,-0.5,if you got a thrill not just out of raping her
5474,0.050000000000000044,"but out of her humiliation afterwards, perhaps i will not have to go on thinking that the friend i loved died for nothing."
5475,0.0,"and one more--"""
5476,0.0,"in a loping movement, gorringe was out of his chair at speed and bending towards miranda with his arm swinging in a wide arc towards her face."
5477,0.0,i had time to see that his hand was open.
5478,-1.5,"it was going to be a slap, an extremely hard one, far more violent than the sort men in movies once gave to women to bring them to their senses."
5479,0.0,i had barely begun to lift my own hand in her defence when adam's rose to intercept and close around gorringe's wrist.
5480,0.7,the deflected sweep of his fastmoving arm provided the momentum that smoothly swung adam to his feet.
5481,-1.0,"gorringe dropped to his knees, just as i had, with his captured hand twisted above his head and about to be crushed, while adam stood over him."
5482,-0.5,it was a tableau of agony.
5483,0.0,miranda looked away.
5484,0.0,"still maintaining the pressure, adam forced the young man back to his chair and, as soon as he was seated, released him."
5485,0.25,so we sat in silence for several minutes as gorringe nursed his arm against his chest.
5486,-0.75,i knew that pain.
5487,-0.5,"as i remembered, i had made more fuss."
5488,0.0,he had appearances to keep up.
5489,-0.15000000000000002,prison culture must have toughened him.
5490,-0.25,late afternoon sunlight suddenly shone into the sitting room and illuminated a long bar of orange carpet.
5491,-0.75,"gorringe murmured, ""i am going to be sick."""
5492,0.0,"but he did not move, and nor did we."
5493,1.0,we were waiting for him to recover.
5494,-1.0,miranda was watching him with an expression of plain disgust that retracted her upper lip.
5495,0.0,"this was what she had come here for, to see him, to really see him."
5496,0.0,but now what?
5497,-0.30000000000000004,she surely doubted there was anything meaningful that gorringe could tell her.
5498,-2.65,he suffered the failure of imagination that afflicted and enabled all rapists.
5499,-1.25,"when his weight was on mariam, when she was pinned to the grass, when she was in his arms, he failed to imagine her fear."
5500,-0.25,even as he saw and heard and smelled it.
5501,-1.75,the lifting curve of his arousal was not troubled by the idea of her terror.
5502,0.9,"at that moment, she may as well have been a sex doll, a device, a machine."
5503,-0.35,or--i had gorringe completely wrong.
5504,1.0,i had the mirror image of the truth.
5505,-0.44999999999999996,i was the one with the failed imagination: gorringe knew the state of mind of his victim all too well.
5506,2.55,"he entered her misery and thrilled to it, and it was precisely this triumph of imagining, of frenzied empathy, that drove his excitement into an exalted form of sexual hatred."
5507,-0.75,i did not know which was worse or whether there was some sense in which both could be true.
5508,0.0,they seemed mutually exclusive to me.
5509,0.0,but i was certain that gorringe did not know either and that he would have nothing to tell miranda.
5510,0.6,"as the sun through the plate glass at our backs sank a little lower, the room was filling with light."
5511,0.0,the three of us sitting in a row on the sofa would have appeared as silhouettes to gorringe.
5512,1.5,"to us he was illuminated like a figure on a stage and it seemed appropriate when he, not miranda, started to speak."
5513,1.9,he pressed his right hand against his chest with his left as though taking a vow of honesty.
5514,0.0,he had dropped the thuggish tone.
5515,-1.35,"pain at this level was a tranquilliser, an enforcer, stripping the affectation out, coaxing his voice back to that of the undergraduate he might have become without miranda's intervention."
5516,-1.0,he was in for armed robbery.
5517,-0.75,the prison was shortstaffed so we were often locked up together for twenty-three hours a day.
5518,0.8,this was right at the beginning of my term.
5519,0.5,"the worst time, everyone says, the first few months, when you do not accept where you are"
5520,-0.55,"and you can not stop thinking about what you could have been doing and how you are going to get out, and getting your appeal together and getting angry with the solicitor because nothing seems to be happening."
5521,0.0,i mean fights.
5522,-1.25,i hey told me i had anger problems
5523,0.8,and they were right.
5524,0.0,i thought because i was six two and played rugby in the second row i could look after myself.
5525,-0.75,that was crap.
5526,-0.8,i knew nothing about real fighting.
5527,-1.0,i got my throat slashed and could have died.
5528,-1.0,"i hated his whistling, his stinking teeth, his press-ups and jumping jacks."
5529,-0.75,he was a vicious little runt.
5530,0.0,"but somehow, in his case, i kept control of myself and he delivered my message once he was out."
5531,-0.5,but i hated you ten times more.
5532,-1.65,i used to lie on my bunk and burn with hatred.
5533,0.0,hours on end.
5534,0.0,and here's the thing
5535,0.0,and you might not believe it.
5536,0.0,"i never connected you with the indian girl."""
5537,-2.25,i just thought you were one of those spiteful man-hating bitches or you woke up the next morning and felt ashamed of yourself and decided to take it out on me.
5538,-1.25,so i lay on my bunk and planned my revenge.
5539,1.1,i was going to save up the money and get someone to do the business for me.
5540,0.0,brian got out.
5541,1.1,i was moved a couple of times and things began to settle into a kind of routine when the days are all the same and time begins to go faster.
5542,0.0,i went into a kind of depression.
5543,0.0,they gave me anger-management counselling.
